transform (v),"เปลี่ยนรูปร่าง, เปลี่ยนแปลง",The photochemical reactions transform the light into electrical impulses.
trainee (n),ผู้ได้รับการฝึกหัด,Many companies recruit graduate trainees to train as managers.
training (n),การอบรม,The company failed to provide adequate training for staff.
tricky (adj),"ยาก, มีเล่ห์เหลี่ยม",It was a very tricky rescue operation as it was a really severe storm.
underline (v),เน้นความสำคัญ,The report underlined that the project enjoyed considerable support in both countries.
underground (adj),"ที่อยู่ใต้ดิน, ที่อยู่ชั้นใต้ดิน",They carried out a series of underground nuclear tests.
urban (adj),"เกี่ยวกับเมือง, เป็นลักษณะของเมือง",People of earlier generations who had not grown up in an urban setting.
urbanite (n),"ชาวเมือง, คนเมือง",What’s a dazzling urbanite like you doing in a rustic setting like this?
variety (n),ประเภท ชนิด หรือลักษณะ,There is a wide variety of patterns to choose from
vantage point (n),ฐานะหรือตำแหน่งซึ่งได้เปรียบ,"From the vantage point of the present, the war seems to have achieved nothing."
vaccinate (v),ฉีดวัคซีน,I was vaccinated against tetanus.
vent (n),"ช่องลม, ช่องระบายอากาศ, ท่อแอร์",The air vents were not soundproof.
visual arts (n),ทัศนศิลป์,"Skilled in writing and in the arts, especially in visual arts."
violate (v),"ฝ่าฝืน, ละเมิด",The peace of the island community had been brutally violated.
volunteer (n),อาสาสมัคร,She does volunteer work at an orphanage.
voluntary (adj),โดยสมัครใจ,Attendance on the course is purely voluntary.
waive (v),สละสิทธิ์,We have decided to waive the tuition fees in your case.
wind tunnel (n),อุโมงค์ลม,They’ve proven in the wind tunnel that it does.
withhold,"ระงับ, ไม่อนุมัติ",The government was threatening to withhold future financial aid.
wreckage (n),ซากปรักหักพัง,A few survivors were pulled from the wreckage.
well-being (n),ความเป็นอยู่ดี,We try to ensure the well-being of our employees.